[
  {
    "detected_at": "2026-02-22T03:05:20.459482+00:00",
    "venue": "binance",
    "market": "spot",
    "symbol": "ADA/USDT",
    "base": "ADA",
    "quote": "USDT",
    "bid_price": 0.2775,
    "ask_price": 0.2776,
    "mid_price": 0.27755,
    "spread_bps": 3.602954
  },
  {
    "detected_at": "2026-02-22T03:05:20.459482+00:00",
    "venue": "binance",
    "market": "spot",
    "symbol": "AVAX/USDT",
    "base": "AVAX",
    "quote": "USDT",
    "bid_price": 9.04,
    "ask_price": 9.05,
    "mid_price": 9.045,
    "spread_bps": 11.055832
  },
  {
    "detected_at": "2026-02-22T03:05:20.459482+00:00",
    "venue": "binance",
    "market": "spot",
    "symbol": "BNB/USDT",
    "base": "BNB",
    "quote": "USDT",
    "bid_price": 623.85,
    "ask_price": 623.86,
    "mid_price": 623.855,
    "spread_bps": 0.160294
  },
  {
    "detected_at": "2026-02-22T03:05:20.459482+00:00",
    "venue": "binance",
    "market": "spot",
    "symbol": "BTC/USDT",
    "base": "BTC",
    "quote": "USDT",
    "bid_price": 67978.04,
    "ask_price": 67978.05,
    "mid_price": 67978.045,
    "spread_bps": 0.001471
  },
  {
    "detected_at": "2026-02-22T03:05:20.459482+00:00",
    "venue": "binance",
    "market": "spot",
    "symbol": "DOGE/USDT",
    "base": "DOGE",
    "quote": "USDT",
    "bid_price": 0.09741,
    "ask_price": 0.09742,
    "mid_price": 0.097415,
    "spread_bps": 1.026536
  },
  {
    "detected_at": "2026-02-22T03:05:20.459482+00:00",
    "venue": "binance",
    "market": "spot",
    "symbol": "ETH/USDT",
    "base": "ETH",
    "quote": "USDT",
    "bid_price": 1972.71,
    "ask_price": 1972.72,
    "mid_price": 1972.715,
    "spread_bps": 0.050692
  },
  {
    "detected_at": "2026-02-22T03:05:20.459482+00:00",
    "venue": "binance",
    "market": "spot",
    "symbol": "LINK/USDT",
    "base": "LINK",
    "quote": "USDT",
    "bid_price": 8.85,
    "ask_price": 8.86,
    "mid_price": 8.855,
    "spread_bps": 11.293055
  },
  {
    "detected_at": "2026-02-22T03:05:20.459482+00:00",
    "venue": "binance",
    "market": "spot",
    "symbol": "LTC/USDT",
    "base": "LTC",
    "quote": "USDT",
    "bid_price": 54.48,
    "ask_price": 54.49,
    "mid_price": 54.485,
    "spread_bps": 1.835368
  },
  {
    "detected_at": "2026-02-22T03:05:20.459482+00:00",
    "venue": "binance",
    "market": "spot",
    "symbol": "SOL/USDT",
    "base": "SOL",
    "quote": "USDT",
    "bid_price": 84.98,
    "ask_price": 84.99,
    "mid_price": 84.985,
    "spread_bps": 1.176678
  },
  {
    "detected_at": "2026-02-22T03:05:20.459482+00:00",
    "venue": "binance",
    "market": "spot",
    "symbol": "XRP/USDT",
    "base": "XRP",
    "quote": "USDT",
    "bid_price": 1.4272,
    "ask_price": 1.4273,
    "mid_price": 1.42725,
    "spread_bps": 0.700648
  },
  {
    "detected_at": "2026-02-22T03:05:20.459482+00:00",
    "venue": "bybit",
    "market": "spot",
    "symbol": "ADA/USDT",
    "base": "ADA",
    "quote": "USDT",
    "bid_price": 0.2775,
    "ask_price": 0.2776,
    "mid_price": 0.27755,
    "spread_bps": 3.602954
  },
  {
    "detected_at": "2026-02-22T03:05:20.459482+00:00",
    "venue": "bybit",
    "market": "spot",
    "symbol": "AVAX/USDT",
    "base": "AVAX",
    "quote": "USDT",
    "bid_price": 9.04,
    "ask_price": 9.05,
    "mid_price": 9.045,
    "spread_bps": 11.055832
  },
  {
    "detected_at": "2026-02-22T03:05:20.459482+00:00",
    "venue": "bybit",
    "market": "spot",
    "symbol": "BNB/USDT",
    "base": "BNB",
    "quote": "USDT",
    "bid_price": 624.0,
    "ask_price": 624.1,
    "mid_price": 624.05,
    "spread_bps": 1.602436
  },
  {
    "detected_at": "2026-02-22T03:05:20.459482+00:00",
    "venue": "bybit",
    "market": "spot",
    "symbol": "BTC/USDT",
    "base": "BTC",
    "quote": "USDT",
    "bid_price": 67981.3,
    "ask_price": 67981.4,
    "mid_price": 67981.35,
    "spread_bps": 0.01471
  },
  {
    "detected_at": "2026-02-22T03:05:20.459482+00:00",
    "venue": "bybit",
    "market": "spot",
    "symbol": "DOGE/USDT",
    "base": "DOGE",
    "quote": "USDT",
    "bid_price": 0.09742,
    "ask_price": 0.09743,
    "mid_price": 0.097425,
    "spread_bps": 1.026431
  },
  {
    "detected_at": "2026-02-22T03:05:20.459482+00:00",
    "venue": "bybit",
    "market": "spot",
    "symbol": "ETH/USDT",
    "base": "ETH",
    "quote": "USDT",
    "bid_price": 1972.83,
    "ask_price": 1972.84,
    "mid_price": 1972.835,
    "spread_bps": 0.050688
  },
  {
    "detected_at": "2026-02-22T03:05:20.459482+00:00",
    "venue": "bybit",
    "market": "spot",
    "symbol": "LINK/USDT",
    "base": "LINK",
    "quote": "USDT",
    "bid_price": 8.85,
    "ask_price": 8.86,
    "mid_price": 8.855,
    "spread_bps": 11.293055
  },
  {
    "detected_at": "2026-02-22T03:05:20.459482+00:00",
    "venue": "bybit",
    "market": "spot",
    "symbol": "LTC/USDT",
    "base": "LTC",
    "quote": "USDT",
    "bid_price": 54.48,
    "ask_price": 54.5,
    "mid_price": 54.49,
    "spread_bps": 3.670398
  },
  {
    "detected_at": "2026-02-22T03:05:20.459482+00:00",
    "venue": "bybit",
    "market": "spot",
    "symbol": "SOL/USDT",
    "base": "SOL",
    "quote": "USDT",
    "bid_price": 84.98,
    "ask_price": 84.99,
    "mid_price": 84.985,
    "spread_bps": 1.176678
  },
  {
    "detected_at": "2026-02-22T03:05:20.459482+00:00",
    "venue": "bybit",
    "market": "spot",
    "symbol": "XRP/USDT",
    "base": "XRP",
    "quote": "USDT",
    "bid_price": 1.4271,
    "ask_price": 1.4272,
    "mid_price": 1.42715,
    "spread_bps": 0.700697
  }
]